trial_id,title,status,phase,enrollment,enrollment_type,study_type,sponsor,sponsor_class,eligibility_words,start_date,completion_date
NCT02315716,Carfilzomib/Cyclophosphamide/Dexamethasone with Maintenance Carfilzomib in Multiple Myeloma,ACTIVE_NOT_RECRUITING,PHASE2,281.0,,INTERVENTIONAL,"University College, London",,762,2015-06-16,
NCT05112016,Long-term Cohort Study of Mesorectal Excision for Rectal Cancer,RECRUITING,,250.0,,OBSERVATIONAL,Kantonsspital Winterthur KSW,,56,2007-01-01,
NCT00402116,Phase 1/2 Study of Enzastaurin in Newly Diagnosed Glioblastoma Multiforme (GBM) and Gliosarcoma (GS) Patients,COMPLETED,"PHASE1, PHASE2",72.0,,INTERVENTIONAL,Eli Lilly and Company,,199,2006-09,
NCT00747916,"Safety, Efficacy, and Side Effects Study of Interventional Cryotherapy in the Pleural Space(""ICE PLS"")",TERMINATED,PHASE4,3.0,,INTERVENTIONAL,"CSA Medical, Inc.",,186,2008-08,
NCT03206216,Feasibility Study of New Method of Diagnostic and Prediction of Painful CIPN,TERMINATED,NA,1.0,,INTERVENTIONAL,Stanford University,,267,2017-08-04,
NCT01836406,Effect of Ketorolac and Remote Ischemic Preconditioning on Renal Ischemia-reperfusion Injury in Patients Undergoing Partial Nephrectomy,COMPLETED,NA,16.0,,INTERVENTIONAL,Yonsei University,,41,2012-12,
NCT00150657,Study of Carboplatin/Gemcitabine Plus Bevacizumab in Advanced Lung Cancer,UNKNOWN,PHASE2,45.0,,INTERVENTIONAL,St. John Providence Health System,,111,2004-11,
NCT05654077,EBV CAR-T Cells for Nasopharyngeal Carcinoma,UNKNOWN,EARLY_PHASE1,24.0,,INTERVENTIONAL,The Affiliated Hospital of Xuzhou Medical University,,490,2022-01-18,
NCT05683977,A French Real-life Study: EvaluatioN of durvALumab Utilization and Effectiveness for First Line Extensive Stage Small Cell Lung Cancer.,ACTIVE_NOT_RECRUITING,,254.0,,OBSERVATIONAL,AstraZeneca,,94,2022-11-14,
NCT01482377,A Study of RO5479599 Alone or in Combination With Cetuximab or Erlotinib in Participants With Metastatic and/or Locally Advanced Malignant Human Epidermal Growth Factor Receptor (HER3) Expressing Solid Tumors of Epithelial Cell Origin,COMPLETED,PHASE1,145.0,,INTERVENTIONAL,Hoffmann-La Roche,,292,2011-12,
NCT03015701,S9005 Mifepristone in Meningioma,COMPLETED,PHASE3,193.0,,INTERVENTIONAL,SWOG Cancer Research Network,,520,1992-08,
NCT00628901,A Prospective Study Comparing Contour SE™ Microspheres to Embosphere® Microspheres for Treating Symptomatic Uterine Fibroids With Uterine Fibroid Embolization (UFE),COMPLETED,PHASE4,60.0,,INTERVENTIONAL,Boston Scientific Corporation,,193,2006-01,
NCT06978075,Artificial Intelligence Combined With 3D-Preformed Chest Wall Defection Reconstruction System in Chest Wall Tumor Surgery,NOT_YET_RECRUITING,NA,50.0,,INTERVENTIONAL,Wu Weiming,,159,2025-07-01,
NCT03722875,SHR-1210 Plus Apatinib in Patients With Hepatocellular Carcinoma After Surgery,UNKNOWN,NA,45.0,,INTERVENTIONAL,Shanghai Zhongshan Hospital,,242,2018-12-01,
NCT02239575,Collection of Retrospective (Archival) Samples and Prospective Collection of Surplus Tissue and Blood Samples,WITHDRAWN,,0.0,,OBSERVATIONAL,Global BioClinical,,103,2014-03,
NCT03790475,Participation in Competing Strategies for Colorectal Cancer Screening - a Randomized Health Services Study Within the National Screening Program in Poland,UNKNOWN,NA,12298.0,,INTERVENTIONAL,Maria Sklodowska-Curie National Research Institute of Oncology,,86,2018-08-25,
NCT05505175,Outcomes Among Patients in Brazil Receiving Palbociclib Combinations for HR+/HER2- MBC,COMPLETED,,120.0,,OBSERVATIONAL,Pfizer,,73,2022-05-30,
NCT03204812,Durvalumab and Tremelimumab in Treating Chemotherapy Naive Patients With Metastatic Castration-Resistant Prostate Cancer,COMPLETED,PHASE2,31.0,,INTERVENTIONAL,M.D. Anderson Cancer Center,,1179,2017-07-14,
NCT00464919,Sorafenib Plus Tegafur/Uracil (UFUR®) for Hepatocellular Carcinoma (HCC),COMPLETED,PHASE2,50.0,,INTERVENTIONAL,National Taiwan University Hospital,,325,2007-04,
NCT06008730,Proton Beam Radiation Therapy After Treatment for Resected N2 Non-Small Cell Lung Cancer,RECRUITING,PHASE2,20.0,,INTERVENTIONAL,Emory University,,781,2024-12-13,
NCT04859530,Automated Cervical Cancer Screening Using a Smartphone-based Artificial Intelligence Classifier,RECRUITING,NA,5886.0,,INTERVENTIONAL,Prof. Patrick Petignat,,71,2018-08-01,
NCT06102330,Multicenter HomeVENT: Home Values and Experiences Navigation Track,RECRUITING,NA,600.0,,INTERVENTIONAL,Johns Hopkins University,,137,2024-02-06,
NCT06757530,Radiomics Model for Assessing Lymph Node Status in cN0 Patients withHNSCC,COMPLETED,,700.0,,OBSERVATIONAL,First Affiliated Hospital of Chongqing Medical University,,61,2024-11-27,
NCT06098430,Patient-Reported Outcomes and Quality of Life in Adult and Pediatric Patients With Nodular Lymphocyte-Predominant Hodgkin Lymphoma (NLPHL),RECRUITING,,100.0,,OBSERVATIONAL,St. Jude Children's Research Hospital,,140,2024-04-04,
NCT04387630,Neoadjuvant Chemotherapy With or Without Metformin in Early Breast Cancer.,UNKNOWN,"PHASE2, PHASE3",120.0,,INTERVENTIONAL,Mansoura University,,80,2020-06-05,
NCT01105130,L-Arginine Supplementation With or Without Enzyme Inhibitors Treating Erectile Function of Prostate Cancer Survivors,COMPLETED,PHASE2,140.0,,INTERVENTIONAL,Wake Forest University Health Sciences,,556,2010-10-01,
NCT03777930,The Evaluation of Curative Effect on Treatment of Tumor Above Thalidomide Combined With Megestrol,UNKNOWN,PHASE4,200.0,,INTERVENTIONAL,Shenzhen Fifth People's Hospital,,249,2018-12-10,
NCT07315828,Accuracy of Indocyanine Green (ICG) Fluorescence Imaging in Giant Cell Tumor of Bone Surgery,RECRUITING,PHASE4,40.0,,INTERVENTIONAL,Shanghai Jiao Tong University Affiliated Sixth People's Hospital,,61,2026-01-02,
NCT01064128,Study of Different Pain Scores in Single-Port Access (SPA) Laparoscopic Hysterectomy Versus Conventional Laparoscopic Hysterectomy,COMPLETED,PHASE3,40.0,,INTERVENTIONAL,Samsung Medical Center,,80,2010-01,
NCT07107607,Assessing Claims of Cannabis as an Anti-cancer Agent (CATA),RECRUITING,,50.0,,OBSERVATIONAL,HealthPartners Institute,,124,2021-03-19,
NCT07502300,A Study Comparing BL-B01D1 Combined With Tislelizumab Versus Platinum-containing Chemotherapy Combined With Tislelizumab as First-line Treatment in Patients With Extensive-stage Small Cell Lung Cance,NOT_YET_RECRUITING,PHASE3,562.0,,INTERVENTIONAL,"Sichuan Baili Pharmaceutical Co., Ltd.",,564,2026-04,
NCT00336700,A Phase II Study of Gemcitabine and Erlotinib As Adjuvant Therapy In Patients With Resected Pancreatic Cancer,TERMINATED,PHASE2,25.0,,INTERVENTIONAL,"Herbert J. Zeh, III MD, FACS",,382,2006-06,
NCT01935492,8 Continuous vs 8 Intermittent Cycles in First and Second Line in HER2/Neu Neg Metastatic Breast Cancer,COMPLETED,PHASE3,420.0,,INTERVENTIONAL,Borstkanker Onderzoek Groep,,441,2010-11,
NCT06130436,Application of Perioperative Remote Ischemic Conditioning in Patients Undergoing Hepatectomy,COMPLETED,NA,135.0,,INTERVENTIONAL,The Second Affiliated Hospital of Chongqing Medical University,,149,2023-11-02,
NCT02890511,"A Study DHP107, a Novel Oral Paclitaxel Formulation, in Patients With Advanced Solid Tumours or Gastric Cancer",COMPLETED,"PHASE1, PHASE2",28.0,,INTERVENTIONAL,"Daehwa Pharmaceutical Co., Ltd.",,353,2010-08,
NCT04544111,PDR001 Combination Therapy for Radioiodine-Refractory Thyroid Cancer,ACTIVE_NOT_RECRUITING,PHASE2,19.0,,INTERVENTIONAL,Memorial Sloan Kettering Cancer Center,,1662,2020-09-02,
NCT02269111,Quantitative MRI in Assessing Disease in Patients With Brain Tumors,TERMINATED,NA,10.0,,INTERVENTIONAL,Vanderbilt-Ingram Cancer Center,,224,2015-04,
NCT00416871,Interleukin-2 and Interferon in Treating Patients With Metastatic Kidney Cancer,COMPLETED,PHASE3,220.0,,INTERVENTIONAL,Centre Leon Berard,,279,,
NCT00344071,Pilot Study of Inflammatory Breast Cancer in Egypt and Tunisia,COMPLETED,,250.0,,OBSERVATIONAL,National Cancer Institute (NCI),,48,2004-09-08,
NCT00100971,Vaccine Therapy in Treating Patients With Acute Myeloid Leukemia,TERMINATED,PHASE1,9.0,,INTERVENTIONAL,Boston Medical Center,,133,2004-04,
NCT00131911,Sorafenib Tosylate in Treating Patients With Progressive Metastatic Neuroendocrine Tumors,COMPLETED,PHASE2,93.0,,INTERVENTIONAL,National Cancer Institute (NCI),,393,2005-06,
NCT03756311,Expanded Access to NanoPac,NO_LONGER_AVAILABLE,,,,EXPANDED_ACCESS,"NanOlogy, LLC",,6,,
NCT07403071,"Validating Fish Oil's Role in Alleviating Bortezomib-Induced Neuropathy: A Multi-Method Study Integrating Big Data, Experimental, and Clinical Research",NOT_YET_RECRUITING,,200.0,,OBSERVATIONAL,The Affiliated Nanjing Drum Tower Hospital of Nanjing University Medical School,,80,2026-05-01,
NCT07135544,"A Single-arm, Multicenter, Exploratory Study of Adebrelimab Combined With Apatinib and Systemic Chemotherapy for Initially Unresectable Biliary Tract Cancer",RECRUITING,PHASE2,37.0,,INTERVENTIONAL,Yongjun Chen,,576,2025-08-14,
NCT06758544,"A Single-arm, Open-label Clinical Study to Evaluate the Efficacy and Safety of VRT106 in Combination With Chemotherapy for Resectable Pancreatic Cancer",RECRUITING,"PHASE1, PHASE2",18.0,,INTERVENTIONAL,Guangdong Provincial People's Hospital,,124,2025-03-17,
NCT05564234,Role of Laparoscopy in Assessing Resectability of Ovarian Cancer,COMPLETED,NA,30.0,,INTERVENTIONAL,Zagazig University,,111,2019-12-09,
NCT05629234,Roll Over StudY for Patients Who Have Completed a Previous Oncology Study With Osimertinib (TAGRISSO) (ROSY-T),ACTIVE_NOT_RECRUITING,PHASE3,37.0,,INTERVENTIONAL,AstraZeneca,,387,2023-05-08,
NCT02860234,Tailored Operative or Non-operative Management for Low-risk Rectal Cancer After Intensive Neoadjuvant Treatment,COMPLETED,,68.0,,OBSERVATIONAL,Peking University Cancer Hospital & Institute,,304,2016-08,
NCT06758934,Comparison of Textbook Outcomes Between Laparoscopic and Open Total Gastrectomy for Gastric Cancer,COMPLETED,,94.0,,OBSERVATIONAL,Bakirkoy Dr. Sadi Konuk Research and Training Hospital,,31,2024-08-01,
NCT06666634,Validation of ICG-99mTc-nanoscan as Hybrid Tracer for Sentinel Node Biopsy,RECRUITING,NA,29.0,,INTERVENTIONAL,The Netherlands Cancer Institute,,148,2023-04-01,
NCT03982264,Endoscopic Treatment of Rectal Neuroendocrine Tumor(NET) Less Than 10mm,UNKNOWN,NA,90.0,,INTERVENTIONAL,"Nanfang Hospital, Southern Medical University",,63,2019-06-20,
NCT06145464,"Shadow for All, a Citizenship Science Study to Promote the Prevention of Skin Cancer",UNKNOWN,NA,60.0,,INTERVENTIONAL,Universidade do Porto,,234,2024-02-01,
NCT06771609,Phase II Clinical Trial of PD-L1 in Combination with Vinorelbine + Cyclophosphamide + Capecitabine (VEX) Metronomic Chemotherapy with or Without Radiotherapy for Advanced Triple-negative Breast Cancer.,RECRUITING,PHASE2,150.0,,INTERVENTIONAL,"Cancer Institute and Hospital, Chinese Academy of Medical Sciences",,261,2024-09-10,
NCT06858709,Effect of Adding Electroacupuncture to Anti-cancer Therapy-induced Peripheral Neuropathy,RECRUITING,NA,150.0,,INTERVENTIONAL,Zhongnan Hospital,,170,2025-03-20,
NCT04494009,PD-1 Inhibitor INCMGA00012 as Consolidation Therapy After Definitive Concurrent Chemoradiotherapy,ACTIVE_NOT_RECRUITING,PHASE2,110.0,,INTERVENTIONAL,Asan Medical Center,,1229,2020-09-07,
NCT06684509,Atorvaststin and Cardiotoxicity in Acute Myloid Leukemia,NOT_YET_RECRUITING,"PHASE1, PHASE2",46.0,,INTERVENTIONAL,Assiut University,,47,2024-11,
NCT06504199,"Obinutuzumab, Zanubrutinib, and Lenalidomide Followed Short-Cycle of Obinutuzumab and Cytarabine in Newly Diagnosed Mantle Cell Lymphoma",RECRUITING,PHASE2,39.0,,INTERVENTIONAL,"Institute of Hematology & Blood Diseases Hospital, China",,557,2024-07-18,
NCT00121199,"Combination Chemo, Rituximab, and Bevacizumab in Older Patients With Stage II-IV Diffuse Large B-Cell Lymphoma",COMPLETED,PHASE2,73.0,,INTERVENTIONAL,National Cancer Institute (NCI),,866,2005-06,
NCT04329299,Use of Blood Biomarkers to Predict Gastric Cancer Risk,COMPLETED,,6862.0,,OBSERVATIONAL,"National University Hospital, Singapore",,146,2012-12-03,
NCT00900432,Immune Response in Peripheral Blood of Patients With Colon Cancer,COMPLETED,,67.0,,OBSERVATIONAL,University of Arizona,,18,2004-07,
NCT07077798,Adjuvant Sintilimab Plus Lenvatinib for HCC Characterized With VETC Following Liver Resection,NOT_YET_RECRUITING,NA,234.0,,INTERVENTIONAL,Wan-Guang Zhang,,134,2025-08-01,
NCT04000698,Personalized Targeted Preparative Regimen Before T-depleted Allogeneic HSCT in Children With Chemoresistent Acute Leukemias,UNKNOWN,PHASE3,25.0,,INTERVENTIONAL,"Federal Research Institute of Pediatric Hematology, Oncology and Immunology",,303,2019-10-15,
NCT03717298,Evaluation of Ocoxin-Viusid® in Advanced Pancreatic Adenocarcinoma,COMPLETED,PHASE2,30.0,,INTERVENTIONAL,Catalysis SL,,293,2018-10-30,
NCT07077863,Transversus Abdominis Plane Block for Postoperative Pain Management in Gynaecological Cancer Surgery,COMPLETED,,100.0,,OBSERVATIONAL,Duygu Akyol,,39,2024-01-01,
NCT02780687,Afatinib Monotherapy in Patients With ERBB-deregulated Metastatic Urothelial Tract Carcinoma After Failure of Platinum Based Chemotherapy,COMPLETED,PHASE2,42.0,,INTERVENTIONAL,Boehringer Ingelheim,,155,2016-06-09,
NCT07282587,Study of ONC206 (JZP3507) in Advanced Pheochromocytoma and Paraganglioma,RECRUITING,PHASE2,90.0,,INTERVENTIONAL,Jazz Pharmaceuticals,,558,2026-01-02,
NCT06944314,Physicians' Perception About Patient Pain in Flexible Cystoscopy With Local Anesthesia,ENROLLING_BY_INVITATION,NA,120.0,,INTERVENTIONAL,Marmara University,,89,2025-03-01,
NCT02762214,Role of Uterine Manipulator in Hysterectomy - Ro.Man.HY,UNKNOWN,PHASE3,154.0,,INTERVENTIONAL,Catholic University of the Sacred Heart,,112,2015-10,
NCT01872416,A Clinical Study of Liposomal Doxorubicin Combined With Ifosfamide Second-line Treatment in Small Cell Lung Cancer,UNKNOWN,PHASE2,30.0,,INTERVENTIONAL,The First Affiliated Hospital of Guangzhou Medical University,,241,2012-10,
NCT05001516,Study of Turning Point Therapeutics LM-302 in Patients With Advance Solid Tumors,COMPLETED,PHASE1,17.0,,INTERVENTIONAL,"Turning Point Therapeutics, Inc.",,1453,2021-12-29,
NCT04530006,Acetyl-Amantadine as a Biomarker in Patients With Glioblastoma,UNKNOWN,NA,20.0,,INTERVENTIONAL,CancerCare Manitoba,,149,2020-12-02,
NCT04240106,"Niraparib Plus Aromatase Inhibitors for Luminal-like(HER2-,ER+) and gBRCA or HDR+ Metastatic Breast Cancer (LUZERN)",COMPLETED,PHASE2,14.0,,INTERVENTIONAL,MedSIR,,1646,2020-06-15,
NCT07162506,DCRT vs. Surgery in Resectable ESCC Patient Achiving cCR/PR After nCI,RECRUITING,PHASE2,120.0,,INTERVENTIONAL,Tianjin Medical University Cancer Institute and Hospital,,868,2025-08-01,
NCT05938504,Usefulness of Balanced High Protein Supplementation on Recovery and Clinical Outcomes After Chemotherapy,UNKNOWN,NA,154.0,,INTERVENTIONAL,Daesang Wellife,,320,2023-03-14,
NCT04139304,A Study of Daratumumab and Dose-Adjusted EPOCH in Plasmablastic Lymphoma,RECRUITING,EARLY_PHASE1,15.0,,INTERVENTIONAL,AIDS Malignancy Consortium,,1727,2021-05-24,
NCT01025804,Pharmacokinetics of Asparaginase and Antibody Formation in Interfant-06,COMPLETED,,15.0,,OBSERVATIONAL,Aarhus University Hospital,,41,2009-12,
NCT04758533,Clinical Trial to Assess the Safety and Efficacy of AloCELYVIR With Newly Diagnosed Diffuse Intrinsic Pontine Glioma (DIPG) in Combination With Radiotherapy or Medulloblastoma in Monotherapy,ACTIVE_NOT_RECRUITING,"PHASE1, PHASE2",13.0,,INTERVENTIONAL,"Hospital Infantil Universitario Niño Jesús, Madrid, Spain",,593,2021-04-19,
NCT02436733,Pleurectomy/ Decortication (P/D) Preceded or Followed by Chemotherapy in Patients With Early Stage MPM,UNKNOWN,PHASE2,64.0,,INTERVENTIONAL,European Organisation for Research and Treatment of Cancer - EORTC,,364,2016-09-20,
NCT00387933,"Imatinib Mesylate, Vatalanib, and Hydroxyurea in Treating Patients With Recurrent or Relapsed Malignant Glioma",COMPLETED,PHASE1,37.0,,INTERVENTIONAL,Duke University,,537,2005-07,
NCT03253133,Assessing Safety of NIPOX in Peritoneal Carcinomatosis of CRC,COMPLETED,PHASE1,19.0,,INTERVENTIONAL,Institut du Cancer de Montpellier - Val d'Aurelle,,391,2016-05-10,
NCT05235633,ADLs at the End of Acute Treatment for Childhood Leukemia and Non-Hodgkin Lymphoma,UNKNOWN,,20.0,,OBSERVATIONAL,Technical University of Munich,,73,2022-04-19,
NCT00001333,Phase I Study of Intrathecal Topotecan,COMPLETED,PHASE1,30.0,,INTERVENTIONAL,National Cancer Institute (NCI),,254,1993-02,
NCT03650452,"A Phase 2, Multicenter, Randomized, Double-blind, Placebo-controlled Study to Evaluate the Efficacy, Safety, and Tolerability of TAK-935 (OV935) as an Adjunctive Therapy in Pediatric Participants With Developmental and/or Epileptic Encephalopathies",COMPLETED,PHASE2,141.0,,INTERVENTIONAL,Takeda,,125,2018-08-08,
NCT04776447,Atezolizumab Plus Induction Chemotherapy Plus CT-radiotherapy. (APOLO),ACTIVE_NOT_RECRUITING,PHASE2,38.0,,INTERVENTIONAL,Fundación GECP,,1355,2021-06-16,
NCT02202447,Phase 1 of EC1169 In Patients With Recurrent MCRPC,COMPLETED,PHASE1,40.0,,INTERVENTIONAL,Endocyte,,1648,2014-05,
NCT00580281,Effect of Imatinib on Bone Metabolism in Patients With Chronic Myelogenous Leukemia or Gastrointestinal Stromal Tumors,COMPLETED,NA,33.0,,INTERVENTIONAL,Memorial Sloan Kettering Cancer Center,,229,2006-11,
NCT02627430,"Talazoparib and HSP90 Inhibitor AT13387 in Treating Patients With Metastatic Advanced Solid Tumor or Recurrent Ovarian, Fallopian Tube, Primary Peritoneal, or Triple Negative Breast Cancer",WITHDRAWN,PHASE1,0.0,,INTERVENTIONAL,National Cancer Institute (NCI),,741,2016-03,
NCT06169930,Development and Validation of a Survival Prediction Model for Esophageal Cancer Patients After Esophagectomy,COMPLETED,,2957.0,,OBSERVATIONAL,Yongtao Han,,52,2023-12-01,
NCT05900830,Therapy Program for Academic Skills in Children With Intellectual Disability,COMPLETED,NA,20.0,,INTERVENTIONAL,Beni-Suef University,,111,2022-11-15,
NCT00462865,Trial of Chemotherapy and Avastin as Treatment for Women With Breast Cancer at High Risk for Relapse,TERMINATED,PHASE2,18.0,,INTERVENTIONAL,Brown University,,629,2007-11,
NCT05330065,A Study of Intrapleural Administration of Bevacizumab and Camrelizumab for Malignant Pleural Effusion,UNKNOWN,"PHASE1, PHASE2",55.0,,INTERVENTIONAL,The First Affiliated Hospital of Zhengzhou University,,426,2022-08-01,
NCT00303667,Donor Natural Killer Cells and Aldesleukin in Treating Patients w/High Risk AML Undergoing Donor Stem Cell Transplant,COMPLETED,"PHASE1, PHASE2",50.0,,INTERVENTIONAL,"Masonic Cancer Center, University of Minnesota",,712,2005-01,
NCT04287400,Prospective Trial for the Evaluation of Radiogenomics in Advanced Rectal Cancer,UNKNOWN,,210.0,,OBSERVATIONAL,"National Cancer Center, Korea",,58,2019-03-05,
NCT01587300,Neuroblastoma Biology Study,RECRUITING,,1000.0,,OBSERVATIONAL,New Approaches to Neuroblastoma Therapy Consortium,,123,2011-07,
NCT04220892,Pilot Study of Pembrolizumab Combined With Pemetrexed or Abemaciclib for High Grade Glioma,WITHDRAWN,EARLY_PHASE1,0.0,,INTERVENTIONAL,Jose Carrillo,,694,2020-07-08,
NCT06849492,HIM Typing Guides the Treatment of Advanced First-Line Triple-Negative Breast Cancer,NOT_YET_RECRUITING,PHASE2,120.0,,INTERVENTIONAL,Fudan University,,755,2025-04-01,
NCT01043536,Dose Escalation Radiotherapy With Modulation of Intensity and Integrated Boost (SIB-IMRT) in the Treatment of Glioblastomas in Adults,COMPLETED,PHASE1,10.0,,INTERVENTIONAL,Centre Georges Francois Leclerc,,202,2009-09,
NCT06017271,Predictive Value of Epicardial Adipose Tissue for Pulmonary Embolism and Death in Patients With Lung Cancer,WITHDRAWN,,0.0,,OBSERVATIONAL,First Affiliated Hospital Xi'an Jiaotong University,,44,2024-05-01,
NCT01957644,Phase I Dose Escalation Trial of Volasertib in Combination With Azacitidine in Patients With MDS or CMML,TERMINATED,PHASE1,16.0,,INTERVENTIONAL,Boehringer Ingelheim,,377,2013-11-06,
NCT00566644,Intrauterine Levonorgestrel and Observation or Observation Alone in Preventing Atypical Endometrial Hyperplasia and Endometrial Cancer in Women With Hereditary Non-Polyposis Colorectal Cancer or Lynch Syndrome,TERMINATED,PHASE3,600.0,,INTERVENTIONAL,"St George's, University of London",,362,2007-07,
NCT00006444,The Effects of Combination Anti-HIV Medication on Human Papillomavirus (HPV) in HIV-Infected Women,COMPLETED,,160.0,,OBSERVATIONAL,National Institute of Allergy and Infectious Diseases (NIAID),,235,2000-11,
NCT02608034,A Study to Investigate the Effect of Itraconazole and Rifampin on Pharmacokinetics (PK) of Vemurafenib at Steady State,COMPLETED,PHASE1,32.0,,INTERVENTIONAL,"Genentech, Inc.",,300,2016-05-26,
NCT00093834,Vaccine Therapy With or Without Cyclophosphamide and Doxorubicin in Women With Stage IV Breast Cancer,COMPLETED,PHASE1,60.0,,INTERVENTIONAL,Sidney Kimmel Comprehensive Cancer Center at Johns Hopkins,,420,2004-01,
NCT02579564,Systemic Chemotherapy Combined With Recombinant Human Adenovirus Type 5 and Endostatin Injections for Treatment Malignant Hydrothorax in NSCLC Patients,UNKNOWN,PHASE3,134.0,,INTERVENTIONAL,Xinqiao Hospital of Chongqing,,207,2016-10,
NCT00875264,Open-Label Study to Determine the Maximum Tolerated Oral Dose of the Kinase Inhibitor CEP-11981 in Patients With Advanced Cancer,COMPLETED,PHASE1,43.0,,INTERVENTIONAL,Cephalon,,554,2007-09,
NCT00521664,A Trial Comparing a Prophylactic With a Therapeutic Platelet Transfusion Strategy in Two Groups,COMPLETED,PHASE3,400.0,,INTERVENTIONAL,Technische Universität Dresden,,176,2004-09,
NCT07493109,Chidamide for Maintenance Treatment of HBV-infected Diffuse DLBCL in Patients Initially Treated With R-CHOP,RECRUITING,PHASE3,200.0,,INTERVENTIONAL,"Ou Bai, MD/PHD",,530,2026-05-30,
NCT00003099,Chemoprevention Therapy Plus Surgery in Treating Women With Breast Cancer,COMPLETED,PHASE2,52.0,,INTERVENTIONAL,M.D. Anderson Cancer Center,,243,1996-05,
NCT02728999,Does Less Trendelenburg Make a Difference in Robotic Assisted Gynecological Procedures?,TERMINATED,NA,22.0,,INTERVENTIONAL,Wake Forest University Health Sciences,,90,2013-06,
NCT04985032,Accelerated Partial Breast Irradiation (APBI) Using Stereotactic Body Radiation Therapy (SBRT),RECRUITING,,200.0,,OBSERVATIONAL,"RPCR, Inc.",,160,2022-08-15,
NCT04172532,"Testing the Addition of a New Anti-cancer Drug, M3814 (Peposertib), to the Usual Radiotherapy in Patients With Locally Advanced Pancreatic Cancer",RECRUITING,"PHASE1, PHASE2",92.0,,INTERVENTIONAL,National Cancer Institute (NCI),,1169,2021-01-11,
NCT06723132,A Retrospective Study of Prognostic Factors and Survival of Breast Cancer Patients with Brain Metastesis,NOT_YET_RECRUITING,,60.0,,OBSERVATIONAL,Assiut University,,73,2025-01-01,
NCT03887598,Application of Ultrasound Artificial Intelligence and Elastography in Differential Diagnosis of Breast Nodules,UNKNOWN,,2000.0,,OBSERVATIONAL,Xin-Wu Cui,,61,2019-01-18,
NCT07462663,SHAPE-ENDO: Multimodal Pre-Surgical Optimization in Patients With Obesity and Early-Stage Endometrial Cancer,NOT_YET_RECRUITING,,82.0,,OBSERVATIONAL,Hospital Universitari de Bellvitge,,147,2026-05,
NCT01560663,Predictors of Response to Neoadjuvant Docetaxel-Carboplatin Chemotherapy for Patients With Stage II and III Triple Negative Breast Cancer,UNKNOWN,,415.0,,OBSERVATIONAL,Miguel Martín Jiménez,,170,2012-01,
NCT00351598,Lung Tumour Volume Database,COMPLETED,,531.0,,OBSERVATIONAL,Trans Tasman Radiation Oncology Group,,168,1999-09,
NCT05080998,Longitudinal Bladder Cancer Study for Tumour Recurrence,RECRUITING,,450.0,,OBSERVATIONAL,Pacific Edge Limited,,229,2022-06-08,
NCT01386398,"Vorinostat With or Without Bortezomib in Treating Patients With Refractory or Recurrent Stage IIB, Stage III, or Stage IV Cutaneous T-Cell Lymphoma",WITHDRAWN,PHASE3,0.0,,INTERVENTIONAL,European Organisation for Research and Treatment of Cancer - EORTC,,426,,
NCT07380698,The Effect of Dose and Storage Conditions of Indocyanine Green on Efficacy and Cost in Sentinel Lymph Node Mapping in Gynecological Cancer,RECRUITING,,30.0,,OBSERVATIONAL,Cukurova University,,19,2025-10-03,
NCT07466498,"Estrogen to Improve Quality of Life for Men With Newly Diagnosed or Recurrent Metastatic Hormone Sensitive Prostate Cancer, EQUIP Trial",NOT_YET_RECRUITING,PHASE2,60.0,,INTERVENTIONAL,University of Washington,,816,2026-08-01,
NCT01849263,Ibrutinib in Treating Patients With Relapsed or Refractory Follicular Lymphoma,ACTIVE_NOT_RECRUITING,PHASE2,41.0,,INTERVENTIONAL,National Cancer Institute (NCI),,870,2013-04-02,
NCT06609863,dTACE-HAIC Combined With Bevacizumab and Atezolizumab for Huge Hepatocellular Carcinoma,RECRUITING,NA,27.0,,INTERVENTIONAL,Sun Yat-sen University,,231,2024-10-01,
NCT02033993,Nab-Paclitaxel to Paclitaxel in Advanced Urothelial Cancer Progressing on or After Platinum Containing Regimen.,COMPLETED,PHASE2,199.0,,INTERVENTIONAL,Canadian Cancer Trials Group,,1107,2014-03-11,
NCT01571921,Gamma-delta Tocotrienol as Potential Maintenance Treatment in Women With Metastatic Breast Cancer,COMPLETED,PHASE1,12.0,,INTERVENTIONAL,Malaysia Palm Oil Board,,163,2013-01,
NCT02491593,Quantitative Immunochemical Fecal Occult Blood Test in Symptomatic Patients,COMPLETED,,242.0,,OBSERVATIONAL,Uppsala University,,27,2014-04,
NCT03318393,Study Comparing Bivalirudin Versus Heparin in Neonatal and Pediatric ECMO,COMPLETED,PHASE4,30.0,,INTERVENTIONAL,University of Texas Southwestern Medical Center,,96,2018-03-25,
NCT01727193,The Efficacy and Safety of Leflunomide or Azathioprine Therapy in Myasthenia Gravis Patients After Expand Thymectomy,COMPLETED,PHASE3,290.0,,INTERVENTIONAL,"First Affiliated Hospital, Sun Yat-Sen University",,208,2012-09,
NCT02263014,Psychosocial Outcomes and Contralateral Prophylactic Mastectomy (CPM),ACTIVE_NOT_RECRUITING,,345.0,,OBSERVATIONAL,M.D. Anderson Cancer Center,,115,2014-02-24,
NCT03394716,Monitoring MRI Changes Before and During Radiotherapy Treatment of Brain Tumors,TERMINATED,,45.0,,OBSERVATIONAL,The Netherlands Cancer Institute,,157,2018-01-12,
NCT07188116,Correlation Between COVID-19 and Radiation Pneumonitis in Breast Cancer,NOT_YET_RECRUITING,,200.0,,OBSERVATIONAL,Zhejiang Hospital,,85,2025-09-15,
